{
  "protocolVersion": 1,
  "runId": "3f9c1a1b-6f4f-4bc2-8cf5-0bc70a2b5b11",
  "leaseEpoch": 3,
  "scopeRevision": 9,
  "pageOrdinal": 0,
  "observedFrom": "2026-09-12T14:20:00Z",
  "observedTo": "2026-09-12T14:20:30Z",
  "final": true,
  "results": [
    {
      "address": "192.0.2.10",
      "entryPointId": "ssh-default",
      "transport": "tcp",
      "port": 22,
      "outcome": "open",
      "reasonCode": null,
      "latencyMilliseconds": 4,
      "observedAt": "2026-09-12T14:20:01Z"
    }
  ],
  "summary": {
    "targetsPlanned": 256,
    "attemptsPlanned": 256,
    "attemptsCompleted": 256,
    "partialReason": null
  }
}
