{
  "protocolVersion": 1,
  "runId": "3f9c1a1b-6f4f-4bc2-8cf5-0bc70a2b5b11",
  "leaseEpoch": 3,
  "scopeRevision": 9,
  "pageOrdinal": 3,
  "observedFrom": "2026-09-12T14:20:00Z",
  "observedTo": "2026-09-12T14:20:30Z",
  "final": false,
  "results": [
    {
      "address": "192.0.2.10",
      "entryPointId": "ssh-default",
      "transport": "tcp",
      "port": 22,
      "outcome": "closed",
      "reasonCode": "connection_refused",
      "latencyMilliseconds": 4,
      "observedAt": "2026-09-12T14:20:01Z"
    }
  ],
  "summary": null
}
